{
  "spec": "sigrank/0.1-draft",
  "timestamp": "2026-08-27T00:00:00Z",
  "source": {
    "provider": "anthropic",
    "model": "example-model",
    "tool": "example-tool"
  },
  "telemetry": {
    "input": 1251211,
    "output": 11296121,
    "cache_write": 128196310,
    "cache_read": 2555179769
  },
  "metrics": {
    "yield": 18436.98,
    "leverage": 2042.2,
    "velocity": 9.028,
    "snr": 0.9003,
    "dev10x": 3.31
  }
}
